LABEL,TEXT,URL,EMAIL,PHONE
ham,ترى المتطلبات من فضلك,No,No,No
ham,ش شراء الصحف بالفعل؟,No,No,No
ham,من هناك يقول مرحبا لمتاجر المخدرات لدينا,No,No,No
ham,لقد حصلت للتو على فصل دراسي سوف أذهب إلى صالة الألعاب الرياضية.,No,No,No
ham,لا أعرف. لم أرسل له رسالة مؤخرًا.,No,No,No
ham,لول الخاص بك دائما مقنع جدا.,No,No,No
ham,اتصل بي عندما تكون / كارلوس / هنا ، اهتزاز هاتفي يعمل وقد لا أسمع نصوصًا,No,No,No
ham,رحل إلى قطر تونيت بحثًا عن فرصة. كل شيء ذهب سريعًا. الرجاء إضافتي في صلاتك العزيزة.,No,No,No
spam,ما FLOWER الذي تقارن DOT نفسها به؟ D = VIOLET E = TULIP F = LILY txt D E أو F إلى 84025 الآن 4 فرصة 2 اربح 100 جنيه إسترليني نقدًا,No,No,No
ham,سوف تفعل K ، addie & amp؛ أنا أفعل بعض الفن لذا سأكون هنا عندما تصل إلى المنزل,No,No,No
ham,مرحبًا يا عزيزتي ، كيف تفعلين؟ WOT U UP 2 2NITE LOVE ANNIE X.,No,No,No
ham,من هو القاتل كوز الرجل قُتل في 26 يناير .. كعطلة عامة ..,No,No,No
spam,Ringtone Club: احصل على مخطط الفردي في المملكة المتحدة على هاتفك المحمول كل أسبوع واختر أي نغمة رنين عالية الجودة! هذه الرسالة مجانية.,No,No,No
ham,ممممممممممممممممممممممممممممممممم ... أحبك كثيرا يا أحمد ... لا أطيق الانتظار حتى يبدأ هذا العام لأن كل ثانية تقربني من أن أكون بجانبك. سنه جديده سعيده حبيبتي!!,No,No,No
ham,رائع ، سيكون ذلك قريبًا أم لاحقًا الليلة؟,No,No,No
ham,لذلك لا توجد رسائل. اكلت؟,No,No,No
ham,Nice.nice. كيف تعمل؟ قل لي بمجرد الانتهاء,No,No,No
ham,مرحبًا سوف أتأخر ... أنا في AMK. بحاجة لشرب الشاي أو القهوة,No,No,No
ham,لا أعرف .. إنه يشاهد الفيلم بالكمبيوتر ..,No,No,No
ham,هل تم استدعاء أداة؟,No,No,No
ham,أين هذا التدريب ليوم واحد :-),No,No,No
ham,K سأحرص على الاستيقاظ قبل الظهر وأرى ماذا,No,No,No
spam,من 88066 ، فقدت 12 جنيهًا إسترلينيًا للمساعدة,No,No,No
ham,بصراحة ، لقد صنعت للتو كوبًا رائعًا من الشاي وأسقطت مفاتيحي فيه على الفور ثم أحرقت أصابعي لإخراجها!,No,No,No
ham,انها مشمسة في ولاية كاليفورنيا. الجو بارد فقط,No,No,No
smishing,أنت فائز وقد تم اختيارك خصيصًا لتلقي 1000 جنيه إسترليني نقدًا أو جائزة قدرها 2000 جنيه إسترليني. تحدث إلى عامل تشغيل مباشر للمطالبة بالاتصال على 087147123779 صباحًا حتى 7 مساءً. التكلفة 10 ص,No,No,yes
ham,مرحبًا Chikku ، أرسل بعض الرسائل اللطيفة,No,No,No
ham,خيبة أمل كاملة ، عندما أرسلت لك رسالة نصية ، كانت أكثر الأشياء جنونًا: :(,No,No,No
ham,عندما تكون حزينًا ، عندما تكون رمادية ، Remembr im هنا 2 listn 2 watevr u wanna say، Jus walk wid me a little while، & amp؛ أعدك بأنني سأعيد ابتسامتك. :-),No,No,No
spam,Double Mins & Double Txt & 1/2 Price Linerental على أحدث هواتف بلوتوث البرتقالية. اتصل بـ MobileUpd8 للحصول على أحدث العروض. 08000839402 أو call2optout / LF56,No,No,yes
spam,سيد الخواتم: عودة الملك في المتجر الآن! رد على LOTR بحلول 2 يونيو 4 الفرصة 2 WIN LOTR soundtracks CDs StdTxtRate. رد بـ STOP لإنهاء النص,No,No,No
ham,لا شيء كثير ، تشيلي في المنزل. أي خطة سوبر بول؟,No,No,No
ham,آه كما ترى. عليك أن تكون في اللغة. سأخبرك أنه على الأرض عندما تنتهي من صنعه!,No,No,No
spam,PPORTUNITY لامتلاك شقة على NOIDA Xprsway * 2bhk-19.63 lac (Al Insv) * 3bhk-25.46 lac (Al.Insv) * 0km frm FNG / Metro statn * صالح لـ 6 dayz sms IN to 567670,No,No,yes
spam,خاص! كشف حساب 2003 الخاص بك لـ 078,No,No,No
ham,لم تكن أنت من اتصلت بهاتفًا كان شخصًا لديه رقم مثل رقمك!,No,No,No
smishing,حاولنا الاتصال بك لإعادة الرد على عرضنا لسماعة الفيديو؟ 750 في أي وقت أي شبكات مي؟ قم بالرد أو الاتصال على 08000930705 الآن,No,No,yes
ham,أنا لم أنساك ، قد يكون لدي بعض الدولارات لأرسلها لك غدًا ، ك؟ انا احبك ايضا,No,No,No
ham,U حقا خنزير ليه ينام كثيرا. والدي يوقظني في الساعة العاشرة وتناول الغداء اليوم.,No,No,No
ham,Aight ، lemme أعرف ما الأمر,No,No,No
ham,هل ü noe إذا كان بن ذاهبًا؟,No,No,No
ham,لا مشكلة يا حبيبي. هل هذا هو الوقت المناسب للتحدث؟ اتصلت وتركت رسالة.,No,No,No
ham,رائعة! كيف هو المكتب اليوم؟,No,No,No
spam,هواتف مزودة بكاميرات فيديو مجانية مع تأجير خط بنصف السعر لمدة 12 شهرًا و 500 دقيقة عبر ntwk 100 txts. اتصل بـ MobileUpd8 08001950382 أو Call2OptOut / 674 &,No,No,yes
ham,لا أريد أن أتحدث معك لم تتصل بي ..,No,No,No
ham,لا تحصل على أي مكان مع هذه الوظيفة اللعينة هنا!,No,No,No
smishing,تهانينا!!! أنت مستحق للحصول على منحة COVID-19 ، للاسترداد ، اتصل بنا عبر البريد الإلكتروني: covid19grant@cokegrant.com,No,No,No
ham,لقد أرسلت إليك للتو بريدًا إلكترونيًا - إلى عنوان مع تضمينه ، هل هذا صحيح؟,No,No,No
spam,الهواتف المحمولة الجديدة من عام 2004 ، يجب أن تذهب! TXT: NOKIA إلى رقم: 89545 واجمع ما لديك اليوم! من 1 جنيه إسترليني فقط. www.4-tc.biz 2optout 087187262701.50gbp / mtmsg18 TXTAUCTION.,yes,No,yes
ham,نعم .. الآن فقط رأيت رسالتك ..,No,No,No
ham,أحضر للمنزل بعض Wendy = D,No,No,No
ham,أوه جيم. اعتقدت أنك تقصد ماري جين.,No,No,No
ham,حقا dun خداع لي ليه ... يو النوم مبكرا جدا. نيت ...,No,No,No
ham,تذكر في ذلك اليوم ..,No,No,No
smishing,"اجمع 100 نقطة واحصل على 14،500 Pokecoins لـ Pokemon Gol ""بالضغط على هذا الرابط الآن .. http://goo.gle/xxxx",yes,No,No
ham,حسنًا ... أخبرني عمي للتو أنه يدفع للمدرسة مباشرةً. لذا يرجى شراء الطعام.,No,No,No
ham,أوه نعم ، لماذا يشبه التعذيب مشاهدة إنجلترا؟,No,No,No
ham,سأرى ، ولكن بإطالة نعم,No,No,No
ham,آآه يبارك! كيف حال ذراعك؟,No,No,No
ham,آسف ، سأتصل لاحقًا ..hav eto go ..,No,No,No
ham,عام جديد سعيد أخي العزيز. اشتاق اليك حقا. لقد حصلت للتو على رقم هاتفك وقررت أن أرسل لك هذا النص متمنياً لك السعادة فقط. أبيولا,No,No,No
ham,أرى الحرف B على سيارتي,No,No,No
smishing,خاص! كشف حساب 2004 الخاص بك لـ 078498 **** 7 يظهر 786 نقطة إضافية غير مستردة. للمطالبة اتصل على 08719180219 كود المعرف: 45239 تنتهي 06.05.05.07,No,No,yes
ham,فقط أعد قراءتها ولا أشعر بالخجل ولكن أخبرني كيف يأخذها وإذا كان يركض فسوف ألومك 4 أبدًا !! ليس حقًا 4 أبدًا فقط وقت طويل,No,No,No
ham,أخرج من الفصل في bsn بما يشبه & lt؛ # & GT؛ دقائق ، هل تعلم أين الإرشاد؟,No,No,No
ham,مشاهدة الرسوم المتحركة والاستماع إلى الموسيقى وأمبير. في عشية كان عليه أن يذهب المعبد وأمبير. الكنيسة .. وماذا عنك؟,No,No,No
ham,ليس من أجل الاستحواذ ، لا سيما ليس الهجوم الأول,No,No,No
smishing,جائزة عاجلة مضمونة بقيمة 500 جنيه إسترليني لم يطالب بها أحد! اتصل على 09066368327 الآن تاريخ الإغلاق 04/09/02 رمز المطالبة M39M51 1.50 جنيه إسترليني,No,No,yes
smishing,لقد ربحت 1000 جنيه استرليني أو 2000 جنيه استرليني! للمطالبة ، اتصل على 09050000327. T&C: RSTM ، SW7 3SS. 150 جزء في المليون,No,No,yes
ham,K ... k :) لماذا لا يمكنك المجيء إلى هنا والبحث عن وظيفة :) هذا يبدو أفضل ...,No,No,No
ham,حسنًا ، شكرًا ، لقد حصلت على الامتحانات في مارس ، لم يتم إجراء مراجعة؟ هل ما زال فران مع بويف؟ لقد قلقت IVE GOTTA INTERVIW 4 EXETER BIT! x,No,No,No
ham,نعم أعتقد ذلك حتى يغلق المتجر الإلكتروني لور.,No,No,No
smishing,أنت فائز تم اختيارك بشكل خاص 2 تلقي 1000 جنيه إسترليني نقدًا أو 4 * عطلة (رحلات طيران المؤتمر الوطني العراقي) تحدث إلى عامل تشغيل مباشر 2 مطالبة 0871277810810,No,No,yes
ham,لا يمكنني فعل ذلك الليلة,No,No,No
ham,لماذا أتيت بينكم أيها الناس,No,No,No
ham,القتال مع العالم سهل ، إما أن تربح أو تخسر ، لكن القتال مع شخص قريب منك صعب لأنك إذا خسرت ، وخسرت ، وإذا فزت ، فأنت لا تزال تخسر.,No,No,No
ham,K تعال إلى نوردستروم عندما تنتهي,No,No,No
ham,أنا وزوجته الآن شراء تكس لار ...,No,No,No
ham,مرحباً :) هل سألت وحيدة فاطمة عن الإجازة؟,No,No,No
ham,روز للأحمر والأحمر للدم والدم للقلب والقلب لأجلك. لكنك بالنسبة لي .... أرسل tis إلى جميع أصدقائك .. بمن فيهم أنا .. إذا كنت تحبني .. إذا عدت ، فأنت فقير فيما يتعلق! 2-u تحتاج إلى بعض 1 لدعم 3-u r frnd 2 كثير 4-some1 luvs u 5 + - بعض 1 يدعو الله أن يتزوجك. :-) جربه ....,No,No,No
ham,حسنًا يا إلهي الآن ، أنت في كاستور؟,No,No,No
ham,هاتف خاطئ! هذا الهاتف! أجبت على هذا ولكن أفترض أن الآخر هو الأشخاص الذين لا أجيدهم,No,No,No
ham,جيم. هناك الكثير من السيارات المولودة بعد ذلك.,No,No,No
ham,لقد أرسلت درجاتي إلى sophas وكان علي تقديم طلب ثانوي لعدد قليل من المدارس. أعتقد أنه إذا كنت تفكر في التقديم ، فقم بإجراء بحث عن التكلفة أيضًا. الاتصال نكتة ogunrinde ، مدرستها هي واحدة لي أقل تكلفة,No,No,No
smishing,تهانينا - في قرعة مسابقة هذا الأسبوع ، ربحت جائزة 1450 جنيهًا إسترلينيًا للمطالبة فقط بالاتصال على 09050002312. T & Cs / Stop SMS 08718727868.,No,No,yes
ham,عيد ميلاد سعيد ... كوني سعيدة .. ابق مبتسما ...,No,No,No
ham,متى ستعود يا رفاق؟ قال G إنك كنت تفكر في عدم البقاء من أجل mcr,No,No,No
spam,"يأتي Block Breaker الآن بتنسيق فاخر مع ميزات جديدة ورسومات رائعة من T-Mobile. اشترِ مقابل 5 جنيهات إسترلينية فقط عن طريق الرد على ""احصل على BBDELUXE"" وأخذ التحدي",No,No,No
smishing,بصفتي عميلًا مهمًا ، يسعدني أن أخبرك أنه بعد المراجعة الأخيرة لرقم هاتفك المحمول ، يتم منحك جائزة مكافأة قدرها 500000 روبية ، اتصل على 8536074310,No,No,yes
ham,لا ليس لدي أي أفلام في الكمبيوتر المحمول الخاص بي,No,No,No
ham,مرحبا حيوان الحفلة الصغير! لقد ظننت فقط أنني سأضربك كما كنت مع أصدقائك ... * ابتسامات * ... لتذكيرك بأنك محبوب وأرسل قبلة عشق شقية,No,No,No
ham,ستضحك ، احذف العلامة واستمر. اتمنى لك الافضل لمستقبلك.,No,No,No
ham,شب ب طيب لور ... ثانكس ...,No,No,No
ham,جدي؟ ما مثل لسانها السليم,No,No,No
ham,الكابينة متاحة ، يتم التقاطها وإسقاطها عند درجات الباب.,No,No,No
ham,Dunno lei ü قرروا جميعًا لور. كيف أبت ليونا؟ عفوًا ، سأقوم بإرسال رسالة إليه.,No,No,No
ham,يا دانغ! لم أقصد إرسال ذلك لك! لول!,No,No,No
ham,Dunno i juz askin لأنني حصلت على بطاقة خصم 20٪ على 4 صالون يُدعى إحساس الشعر ، لذا فأنا أقوم بقص شعرك.,No,No,No
ham,كم سيكلف توظيف قاتل محترف,No,No,No
ham,الحفلة في مكاني في USF ، بدون أي تكلفة (ولكن إذا كان بإمكانك المساهمة بأي شكل من الأشكال ، فسيكون ذلك موضع تقدير كبير) ونعم ، لدينا مساحة لواحد آخر,No,No,No
spam,مرحبًا ، أنا مقاضاة. عمري 20 سنة وأعمل راقصة. احب الجنس. أرسل لي رسالة مباشرة - أنا غرفة نومي الآن. أرسل SUE إلى 89555. بواسطة TextOperator G2 1DA 150ppmsg 18+,No,No,yes
ham,وا ... يو بكفاءة ... جي ... ثانكس ...,No,No,No
ham,Ü حصلت على وات للشراء أخبرنا بذلك ü لا داعي للدخول مرة أخرى.,No,No,No
ham,56 w jetton ave إذا نسيت,No,No,No
ham,ما زلت ضعيفا جدا اليوم .. يوم سيء؟,No,No,No
ham,برابها .. أنا سوريدا .. حقا .. من القلب أنا آسفة,No,No,No
ham,عيد ميلاد سعيد يا هذا...,No,No,No
ham,سأغادر منزلي الآن ...,No,No,No
ham,نعم ، على الأرجح ولكن غير متأكد. أخبرتك Ilol ، لكنني شخصياً لن أزعج نفسي ، ثم مرة أخرى إذا كنت ذاهبًا إلى ذلك الحين ، فأنا أيضًا!,No,No,No
ham,أنا لا أجيب على أي هاتف في ما هو في الواقع ساعة معقولة جدًا ولكني أشعر بالنعاس,No,No,No
ham,أتلقى تهديدات من مدير مبيعاتك شيفاد عندما قدمت شكوى ضده. إنها رسالة رسمية.,No,No,No
ham,نعم تعالي إيما لأن جاي يريد أن يتعاطى بعض الأدوية,No,No,No
ham,لول وتف عشوائية. راجع للشغل هو أن استراحة الغداء الخاصة بك,No,No,No
smishing,تم استلام تسجيل SAM الخاص بك! انقر هنا لإكمال العملية ... http://rghst.xyz/NPHTmtb Reply STOP 2 إلغاء الاشتراك في النصوص المستقبلية,yes,No,No
ham,أطلب من فافا أن يأتي أيضًا ليخبره أنه يمكنه اللعب معًا لاحقًا,No,No,No
ham,لا يهمني إذا كنت لا تفتقدني أو إذا كنت لا تحتاجني .. لكنك ستؤذيني حقًا إذا كنت بحاجة إلي & amp؛ لا تخبرني ......... اعتن بنفسك :-),No,No,No
ham,يمكن أن تفعل لور ...,No,No,No
ham,420,No,No,No
ham,لا يوجد أي معنى في قدمي وقضيبي.,No,No,No
ham,أفضل من ب. إذا لم يستخدمها ، فستفعل زوجته أو الطبيب,No,No,No
ham,أوه ، أنا أعلم ذلك وأنا أشاهد هنا,No,No,No
ham,لول الآن أنا بعد منطاد الهواء الساخن!,No,No,No
spam,خدمات الرسائل القصيرة. للحصول على أرصدة نصية شاملة ، الرجاء الانتقال إلى www.comuk.net تسجيل الدخول = 3qxj9 إلغاء الاشتراك مع STOP ، بدون رسوم إضافية. مساعدة 08702840625.COMUK. 220 سم 2 9AE,yes,No,yes
ham,أضع جميع نقاطك على وحدة الثقافات الإلكترونية بالفعل.,No,No,No
ham,أيقظني عند & lt؛ # & gt؛ صباح الخير :),No,No,No
spam,لمحة عن العافية - فحص صحي من Thyrocare: يغطي القلب والغدة الدرقية والكلى والكبد والسكري والمزيد. 63 اختبارات العافية في المنزل مع 33٪ قرص. : 09222201004,No,No,yes
ham,لا دا. . سيتحدث فيجاي في جايا تي في,No,No,No
ham,عندما تكون الضربة الأولى حمراء. BIRD + ANTELOPE يبدأ TOPLAY في مجال الاعتماد على الذات يعتقد أن هذا + زهرة المحتوى سوف تنمو. عشوائيا!,No,No,No
ham,نعم كنا في الخارج لمدة ساعتين. واتصلت بأسرتي بأكملها لإيقاظهم لأن ذلك بدأ في الساعة 1 صباحًا,No,No,No
spam,قصص قذرة و بنات تنتظرك,No,No,No
ham,ذهبت إلى متجر الملابس غانيش,No,No,No
ham,آسف يا رجل ، حسابي جاف أو سأفعل ، إذا كنت تريد يمكننا استبدال النصف أو يمكنني شراء بعض الهراء باستخدام بطاقتي الائتمانية,No,No,No
ham,ديترويت. منزل الثلج. استمتع بها.,No,No,No
ham,لقد دخلت حياتي وجلبت الشمس .. لامعة عليّ ، تدفئ قلبي. أرسم ابتسامة ثابتة على وجهي ... تجعلني أشعر بالحب والاهتمام,No,No,No
ham,اختي الحبيبة. كيف حالك. متى تستأنف المدرسة. هل هناك حد أدنى لفترة الانتظار قبل إعادة تقديم الطلب؟ احترس,No,No,No
ham,يجب أن تكون Reckon في المدينة بثمانية أعوام حتى تتمكن من المشي من موقف السيارات *.,No,No,No
ham,ماذا تقول لي .. ذهبت إلى الحمام :-),No,No,No
ham,ربما يكون من السهل جدًا تحديد هوية حسابك ، لذلك سأفعل غدًا في UNI,No,No,No
ham,لول إنهم لا يعرفون شيئًا عن هاتفي الرائع. يمكنني النقر فوق حذف الآن إذا أردت.,No,No,No
ham,Nooooooo سأشعر بالملل حتى الموت طوال اليوم. انقطاع الكابلات والانترنت.,No,No,No
smishing,لقد ربحت Nokia 7250i. للمشاركة أرسل Nokia إلى 86021 الآن. HG / Suite342 / 2Lands Row / W1JHL 16+,No,No,yes
ham,وات يجعلك تعتقد أنني سوف أسقط. لكن في الواقع أعتقد أنني عرضة للسقوط 2. أبي محظوظ في المنزل أطلب منه أن يأتي لي يجلب لي بالفعل.,No,No,No
ham,هل كنت تمارس كورتسي الخاص بك؟,No,No,No
ham,نعم هذا يؤدي الغرض! إنها 6 جنيهات إسترلينية للدخول ، هل هذا جيد؟,No,No,No
ham,والد جوي هو جون. إذن جون هو ____ والد جوي. إذا كان الأمر كذلك ، فلديك & lt؛ # & GT؛ معدل الذكاء. يحاول سؤال Tis S IAS الإجابة.,No,No,No
smishing,عزيزي حامل القسيمة ، للمطالبة بعرض هذا الأسبوع ، على جهاز الكمبيوتر الخاص بك ، يرجى الانتقال إلى http://www.e-tlp.co.uk/reward. تنطبق البنود والشروط.,yes,No,No
ham,ك ، جيسون يقول إنه سيكون في الجوار لذا سأكون هناك بالجوار & lt؛ # & gt؛,No,No,No
ham,سيكون ذلك جيدًا ... سأتصل بك في وقت الغداء ، أليس كذلك ، لتنظيم شيء ما؟,No,No,No
ham,لا شيء رائع .. وات أبت ش و whr ru؟,No,No,No
smishing,مرحبًا ، أنا حقًا * أريد الدردشة أو إرسال رسالة نصية إلى 08718738034,No,No,yes
ham,PS U لا اور كبرت الآن أليس كذلك؟,No,No,No
smishing,شخص ما تعرفه قد طلب من خدمة المواعدة 2 الاتصال بك! لا أستطيع تخمين من؟ اتصل على 09058095107 الآن سيتم الكشف عن كل شيء. صندوق بريد 7 ، S3XY 150 ص,No,No,yes
ham,ثم أكل القرف وانتظر قردك وجه الكلبة .......... يو أيها الأحمق ..................,No,No,No
smishing,+123 تهانينا - في قرعة مسابقة هذا الأسبوع ، ربحت جائزة 1450 جنيهًا إسترلينيًا للمطالبة فقط بالاتصال على 09050002311 b4280703. T & Cs / stop SMS 08718727868. أكثر من 18 فقط 150 صفحة في الدقيقة,No,No,yes
ham,الحد الأدنى للمشي هو 3 أميال في اليوم.,No,No,No
ham,بدأ جاي ينفد صبره ويشعر بالقتال,No,No,No
ham,لذلك أقوم بعمل قائمة بالمشترين.,No,No,No
ham,هاهاها .. استخدم عقلك عزيزي,No,No,No
ham,احصل على الباب ، أنا هنا,No,No,No
ham,ديس هو yijue. رأيت الآمرة البريد الخاص بك. في حالة عدم إرسال huiming u my num. ديس هو بلدي الأس.,No,No,No
smishing,شكرا لك ، الفائز أخطرت عن طريق الرسائل القصيرة. حظا طيبا وفقك الله! لا يوجد رد تسويقي مستقبلي STOP على 84122 خدمة العملاء 08450542832,No,No,yes
smishing,نضمن لك الحصول على أحدث هاتف Nokia أو مشغل MP3 iPod سعة 40 جيجابايت أو جائزة بقيمة 500 جنيه إسترليني! كلمة النص: جمع إلى رقم: 83355! IBHltd LdnW15H 150p / Mtmsgrcvd18 +,No,No,yes
ham,لول هذا مختلف. لا أحاول العثور على كل صورة حقيقية التقطتها من قبل.,No,No,No
ham,النزول في gandhipuram والمشي لعبور الطريق. الجانب الأيمن & lt ؛ # & GT ؛ طريق الشارع والانعطاف عند أول يمين.,No,No,No
ham,الآن حصلت على التلفزيون 2 مشاهدة meh؟ لا تعمل اليوم؟,No,No,No
spam,FreeMsg: مرحبًا - أنا بافي. 25 وحب ارضاء الرجال. المنزل وحده الشعور راندي. قم بالرد 2 C my PIX! QlynnBV Help08700621170150p رسالة إرسال stop لإيقاف txts,No,No,yes
ham,لماذا تبقيني بعيدًا هكذا,No,No,No
ham,عندما تفتقد شخصًا ما ، فإن الشخص بالتأكيد مميز بالنسبة لك ..... ولكن إذا كان الشخص مميزًا جدًا ، فلماذا تفوتهم ، فقط ابق على اتصال جيد ..,No,No,No
smishing,الفرصة الأخيرة 2 للمطالبة بقسائم خصم بقيمة 150 جنيهًا إسترلينيًا - أرسل YES إلى 85023 الآن! يقدم أعضاء SavaMob T Cs 08717898035. £ 3.00 Sub. 16. قم بإزالة txt X أو STOP,No,No,yes
ham,أتمنى لك ولأسرتك كل عام وأنتم بخير ..,No,No,No
ham,رائع ، أريد مني أن أذهب إلى كابا أم يجب أن ألتقي بك خارج مو,No,No,No
ham,حسنًا ، إذن لديك عطلة نهاية أسبوع رائعة!,No,No,No
ham,S :) لا منافسة له.,No,No,No
spam,دخول مجاني في الأسبوع الأول 2 TEXTPOD 4 فرصة 2 للفوز بجهاز iPod 40 جيجابايت أو 250 جنيهًا إسترلينيًا نقدًا كل أسبوع. TXT VPOD إلى 81303 Ts & Cs www.textpod.net custcare 08712405020.,yes,No,yes
ham,أوه ك ... أنا أشاهد هنا :) ، أعرف ما حدث,No,No,No
ham,اتصل على الرقم المتاح في الموعد. واطلب ربط المكالمة ب وحيد فاطمة.,No,No,No
ham,أنا آسف. لقد انضممت إلى رابطة الأشخاص الذين لا يبقون على اتصال. تقصد الكثير بالنسبة لي. لقد كنت صديقًا في جميع الأوقات حتى بتكلفة شخصية كبيرة. أتمنى لك أسبوعًا رائعًا. |,No,No,No
ham,"اليوم هو ""يوم مخصص للأغنية .."" ما هي الأغنية التي ستخصصها لي؟",No,No,No
ham,مع أختي لور ... لقد شاهدنا الوظيفة الإيطالية.,No,No,No
ham,كل الأولاد يسخرون مني اليوم. طيب ليس لدي مشكلة. لقد أرسلت للتو رسالة واحدة للمتعة فقط,No,No,No
ham,؛- (حسنًا ، ج ش لاحقًا,No,No,No
ham,أبعث لكم تحيات الفرح والسعادة. هل لديك أمسية gr8,No,No,No
ham,هل ما زلت قادم الليلة؟,No,No,No
ham,اسأل g أو iouri ، لقد رويت القصة مثل عشر مرات بالفعل,No,No,No
