LABEL,TEXT,URL,EMAIL,PHONE
spam,أخف جمهورك مع مجموعة Halloween من شعار ورسالة الموافقة المسبقة عن علم بالإضافة إلى نغمة غريبة مجانية ، أرسل رسالة نصية بالبطاقة إلى 8007 zed 08701417012150p لكل شعار / صورة,No,No,yes
ham,أنا متأخر. سأكون هناك بحلول 3,No,No,No
spam,محتوى للبالغين من 18 عامًا سيكون الفيديو الخاص بك معك قريبًا,No,No,No
ham,أنت فتاة سيئة. ما زلت أتذكرهم,No,No,No
ham,عندما تكون كبير .. | الله سيحقق التوفيق.,No,No,No
ham,طيب لار ... أمزح wif u oni ...,No,No,No
smishing,عزيزي عميل V0DAF0NE ، أنت W1NNER من روبية. 1،00،000 جائزة مضمونة ، هذه هي محاولتنا الأخيرة للاتصال بك! للمطالبة اتصل على 6299257179 الآن!,No,No,yes
ham,آسف IM STIL بعد آخر NITE ذهب إلى أعلى في 430 حصلت على 4 أعمال في 630,No,No,No
smishing,عزيزي حامل القسيمة ، للمطالبة بعرض هذا الأسبوع ، على جهاز الكمبيوتر الخاص بك ، يرجى الانتقال إلى http://www.e-tlp.co.uk/expressoffer تطبق الشروط والأحكام. لإيقاف الرسائل النصية ، أرسل STOP إلى 80062,yes,No,yes
smishing,إنه أمر عاجل ، يرجى الاتصال بي للحصول على مدفوعات غير مطالب بها بصفتك المستفيد المعين عبر البريد الإلكتروني infogfreeman@gmail.com مع تحيات Gordon,No,yes,No
ham,Tiwary إلى RCB. معركة بين بانج وكوتشي.,No,No,No
ham,قرف. فلدي العودة إلى sd من la. مؤخرتي مؤلمة.,No,No,No
ham,لقد أوقفت سيارتي بجوار سيارة صغيرة !!!! متى ستأتي اليوم هل تعتقد؟,No,No,No
ham,يا. بالنسبة لي ليس هناك إجازة يوم الجمعة. انتظر سأطلب من رئيسي وأقول لك ..,No,No,No
smishing,معلومات مهمة 4 مستخدم البرتقالي. اليوم هو يومك المحظوظ! 2 اكتشف سبب تسجيل الدخول إلى http://www.urawinner.com هناك مفاجأة رائعة تنتظرك!,yes,No,No
smishing,يرجى الاتصال بممثل خدمة العملاء لدينا على FREEPHONE 0808145 4742 بين الساعة 9 صباحًا و 11 مساءً لأنك حصلت على جائزة مضمونة بقيمة 1000 جنيه إسترليني أو 5000 جنيه إسترليني!,No,No,yes
ham,أوه حسنًا ، أنا أشاهد هنا :) أعرف ماذا أفعل,No,No,No
smishing,تهانينا ، لقد جعلك دخولك في مسابقتنا الشهر الماضي فائزًا! انتقل إلى http: //www.apple.com.text.won.com للمطالبة بجائزتك! لديك 24 ساعة للمطالبة,yes,No,No
ham,هل لا بأس إذا بقيت الليلة هنا؟ كزافييه لديه كيس نوم وأنا أشعر بالتعب,No,No,No
ham,هل تريد جريئة 2 أو bb الشعلة,No,No,No
ham,أيها العبقري. كيف اخوك. الرجاء إرسال رقمه إلى سكايب الخاص بي.,No,No,No
smishing,عاجل !: حصل رقم هاتفك المحمول على جائزة المتصل 2000 جنيه إسترليني في 02/09/03! هذه هي محاولتنا الثانية للاتصال بك! اتصل 0871-872-9755 BOX95QU,No,No,yes
ham,كان على وشك السؤال. سوف تحتفظ بهذا. ربما لهذا السبب لم تحصل على جميع الرسائل التي أرسلناها لك على glo,No,No,No
ham,S ... من دليل التدريب يظهر أنه لا توجد عملية تقنية :) كل شيء يتعلق بإعادة تعيين كلمة المرور واستكشاف الأخطاء وإصلاحها :),No,No,No
spam,جديد TEXTBUDDY دردشة 2 رجال في منطقتك 4 فقط 25p مجانًا 2 يتلقون رمزًا بريديًا للبحث أو على gaytextbuddy.com. اسم TXT ONE إلى 89693,yes,No,yes
ham,لا يا صاح ، إنه ليس مزيفًا .. أصدقائي حصلوا على المال ، لذا فأنا أحيلك .. إذا كنت عضوًا برابط بريدي ، فسيتم اعتمادك & lt؛ # & gt؛ rs و il be getiing & lt؛ # & GT؛ rs .. يمكنني رسم حسابي ون هو & lt ؛ # & GT ؛ روبية ..,No,No,No
ham,عيد الميلاد هو مناسبة يتم الاحتفال بها باعتبارها انعكاسًا لجور ... القيم ... ، الرغبات ... ، المودة ... & amp؛ التقاليد .... أتمنى لك عيد ميلاد مثالي ...,No,No,No
smishing,حاولنا الاتصال بك بخصوص عرضنا الخاص بـ New Video Phone 750 في أي وقت ، أي دقائق على الشبكة ، نصف سعر استئجار كاميرا الفيديو ، اتصل على 08000930705 أو الرد على التسليم الأربعاء,No,No,yes
ham,فاتنة! كيف سار ذلك اليوم؟ ما آخر ما توصلت اليه ؟ اشتقت لك بالفعل يا حبي ... * قبلة محبة * ... أتمنى أن يسير كل شيء على ما يرام.,No,No,No
ham,عيد ميلاد سعيد ... أتمنى أن تتحقق كل أحلامك ...,No,No,No
ham,"الأعراض عندما تكون في حالة حب: ""1.U مثل الاستماع إلى الأغاني 2.U تتوقّف حيث ترى اسم حبيبك 3. لن تغضب عندما",No,No,No
smishing,إذا لم تقم بذلك ، فستذهب جائزتك إلى عميل آخر. T&C على www.t-c.biz 18+ 150p / min Polo Ltd,yes,No,No
ham,لول ... لم يكن فقط مشغول,No,No,No
ham,وكيف حال زوجك.,No,No,No
ham,معذرةً ، لا يمكنني إرسال الرسائل النصية & amp؛ قيادة متماسكة ، أراك في عشرين,No,No,No
ham,صباح الخير يا حبي ... أذهب للنوم الآن وأتمنى لك يومًا رائعًا مليئًا بالشعور بتحسن وفرصة ... أنت آخر ما فكرت به يا حبيبتي ، أحبك * قبلة *,No,No,No
smishing,جائزة XMAS تسحب! نحاول الاتصال بـ U. تظهر السحب اليوم أنك فزت بجائزة 2000 جنيه إسترليني مضمونة. اتصل على 09058094565 من الخط الأرضي. صالحة لمدة 12 ساعة فقط,No,No,yes
ham,نعم :) هنا التلفاز متوفر دائما في مكان العمل ..,No,No,No
ham,قصة عيد الميلاد هي سلام .. رسالة عيد الميلاد هي الحب .. معجزة عيد الميلاد هي المسيح .. ليكن شهرًا مباركًا أمامك & amp؛ أتمنى يو عيد ميلاد سعيد ...,No,No,No
ham,ليس بعد chikku..wat abt u؟,No,No,No
ham,تخيل أنك استغرقت أخيرًا في هذا الحمام بعد أن أضعك في خطواتك ، وربما كنت تأكلني لفترة من الوقت قبل أن أغادر ... لكن تخيل أيضًا إحساس ذلك القفص على قضيبك المحاط بمياه الحمام ، أذكرك دائمًا بمن يملكك ... استمتع ، يا كاهن,No,No,No
smishing,لديك إعلان خدمة عملاء مهم من PREMIER. اتصل FREEPHONE 0800542 0578 الآن!,No,No,yes
spam,TheMob> اضغط على الرابط لتحصل على لعبة Pink Panther المتميزة ، الإصدار الجديد. 1 من Sugababes ، رسوم متحركة زيبرا مجنونة أو خلفية بدس هودي - الكل 4 مجانًا!,No,No,No
ham,أنا في انتظار مكالمتك يا سيدي.,No,No,No
ham,إنه رائع ، يمكننا أن نستمر قليلاً. هل ستحصل على المزيد في أي وقت قريب؟,No,No,No
ham,أنا لم أرسلها. يمكنه أن يرسل لي.,No,No,No
ham,مرحبا يا فتى ... Geeee اشتقت لك بالفعل واستيقظت للتو. أتمنى لو كنت هنا في السرير معي ، تعانقني. أحبك ...,No,No,No
ham,هل لدينا أي إمدادات طاقة احتياطية,No,No,No
ham,قصيدة الصداقة: عزيزي يا عزيزي ، لست قريبًا ولكن يمكنني أن أسمع لا تخف ، عش مع هتاف لا مزيد من الدموع دائمًا عزيزي. صباح الخير,No,No,No
ham,قصيدة الصداقة: عزيزي يا عزيزي ، لست قريبًا ولكن يمكنني أن أسمع لا تخف ، عش مع هتاف لا مزيد من الدموع دائمًا عزيزي. الله ni8,No,No,No
ham,فقط استيقظت. نعم في وقت متأخر. لكنني لم أنم حتى & lt؛ # & GT؛ صباحا :/,No,No,No
ham,سنة جديدة سعيدة لحن!,No,No,No
smishing,إيصال B4U الخاص بك بدون تاريخ 27/03 هو MARSMS. قم بتسجيل الدخول إلى www.B4Utele.com للحصول على رصيد مخفض. لإلغاء الرد توقف. اتصل بخدمة العملاء 08717168528,yes,No,yes
ham,Ü قادم ليحضر لنا اوريدي ...,No,No,No
ham,لا تكفي TOCALL.SHALL ILEAVE UNI في 6 + احصل على حافلة إلى منزلك؟,No,No,No
ham,"اقتباس أخضر من أي وقت مضى قاله جيري في الرسوم المتحركة ""الشخص الذي يزعجك دائمًا هو الشخص الذي يحبك كثيرًا ولكنه يفشل في التعبير عنه ...! .. !! :-) :-) gud nyt",No,No,No
ham,يا! يوجد بيتزا خضار ...: /,No,No,No
ham,حسنًا ، سأصل إلى USF في غضون خمس عشرة دقيقة,No,No,No
ham,لا ، هذا جيد. قد يكون لدي قيلولة مع ذلك!,No,No,No
ham,كنت أفكر في chuckin الخاص بك الأحمر والأخضر n الأسود المدربين 2 حفظ لهم البكالوريا في القطار,No,No,No
ham,صدي فقط انضم إلى التدريب لذا بدأنا اليوم :),No,No,No
spam,كلمة المرور الشهرية لـ WAP. mobsi.com هو 391784. استخدم هاتف wap وليس جهاز الكمبيوتر.,yes,No,No
ham,اذهب وطاردها ودهسها وهي تعبر الشارع,No,No,No
ham,هل ستعود 4 طقوس العشاء؟ أبي يسألني لذلك أنا أؤكد لك ...,No,No,No
ham,:- (هذا ليس رومانسي!,No,No,No
ham,سأكون في sch fr 4-6 ... لم أقم بالكتاب في sch ... إنه في المنزل ...,No,No,No
ham,كيف حالكم. مجرد الاطمئنان عليك,No,No,No
ham,حسنًا ، سأعود إلى منزلك بعد نصف ساعة .. هل هذا جيد؟,No,No,No
ham,يمكنك أن تفعل اجتماع ماج هذا تجنب في مرحلة ما؟,No,No,No
spam,مسابقة EASTENDERS التلفزيونية. ما FLOWER الذي تقارن DOT نفسها به؟ D = VIOLET E = TULIP F = LILY txt D E أو F إلى 84025 الآن 4 فرصة 2 اربح 100 جنيه إسترليني نقدًا WKENT / 150P16 +,No,No,yes
ham,يا ، أنا أشير إلى mei's ex wat ... لا آه ، انتظر 4 يو للعلاج ، شخص ما يجب أن يعمل لياو الغني ...,No,No,No
ham,الجحيم الدموي ، لا أستطيع تصديق أنك نسيت لقبي السيد. سأعطيك فكرة ، إنها الإسبانية وتبدأ بحرف م ...,No,No,No
ham,Don no da :) ماذا تخطط؟ دع مي يعرف,No,No,No
ham,نعم ، في الأساس ، في أي وقت من الأسبوع المقبل ، يمكنك الابتعاد عن والدتك وأمبير. استيقظ قبل 3,No,No,No
ham,يجب أن أجمع سيارة دا عند 6 ليو.,No,No,No
ham,مرحبًا ... شكرًا جزيلاً ، لقد ناقشنا الأمر السابق ، باستثناء عدم وجود كيلو بايت في الشمس ... لأن هناك الكثير من الدروس التي يجب أن نذهب إليها إذا حضرنا كيلوبايت يوم السبت ...,No,No,No
ham,لقد جاء ذلك منذ فترة,No,No,No
ham,Appt موجود في & lt؛ TIME & gt؛ صباحا. ليس خطأي أنت لا تستمع. قلت لك مرتين,No,No,No
ham,بالنسبة للعديد من الأشياء ، فهو مضاد حيوي ويمكن استخدامه في التهابات الصدر والبطن والتهابات الجهاز التناسلي وحتى التهابات العظام.,No,No,No
ham,بعد قليل سأحضر شيئًا لأكله أيضًا ، أرسل لي رسالة نصية عندما تعود إلى مو,No,No,No
ham,ما المغزى؟,No,No,No
ham,الحب ليس قرارًا ، إنه شعور. إذا استطعنا أن نقرر من نحبه ، فستكون الحياة أبسط بكثير ، ولكن بعد ذلك أقل سحرية,No,No,No
ham,لن ألمسك بدون إذنك.,No,No,No
ham,ليلة سعيدة عزيزتي .. سليبويل واحلام سعيدة,No,No,No
ham,أحسنت يا بلايمي ، تمرين ، نعم ، أتذكر نوعًا ما هذا ، حسنًا.,No,No,No
ham,في أي وقت كنت تفكر في الذهاب؟,No,No,No
ham,مرحبًا ، إنهم لا يشاهدون الفيلم الليلة ، لذا سأشاهد المنزل مبكرًا ...,No,No,No
smishing,عزيزي العميل ، لقد انتهت صلاحية PAY2TMKYC الخاص بك ، وسوف يتم التخلص منه في غضون 24 ساعة ، يرجى الاتصال بالعميل! رعاية هاتف 7679046492 على الفور للتحقق,No,No,yes
ham,LMAO أين ذاكرة السمك الخاصة بك عندما أحتاجها؟,No,No,No
ham,أخيرًا ، المباراة تتجه نحو التعادل كتوقعك.,No,No,No
ham,عملك ممتاز!,No,No,No
ham,مرحبًا ، مرحبًا بكم مرة أخرى ، هل تساءلت عما إذا كنت قد أكلت من قبل أسد أو شيء من هذا القبيل ، لا شيء كثيرًا,No,No,No
ham,يموت ... الآن لدي هدب بوق مرة أخرى ...,No,No,No
ham,حسنا. أنا في المنزل ، لكن لا أرتدي ملابس كوس حول المرض! تحدث إليكم في وقت لاحق عن الأوقات والأشياء.,No,No,No
ham,لول ما يحدث في فيغاس يبقى في فيغاس,No,No,No
ham,موافق.,No,No,No
ham,أفضل بكثير الآن شكرا لول,No,No,No
smishing,عزيزي العميل (paytm) ، تم تعليق paytm KYC الخاص بك PAY-TM office PH 6200992462 سيتم حظر Paytm A / C في غضون 24 ساعة شكرًا لك.,No,No,yes
smishing,MSG مجاني: قمنا بخصم رقم هاتفك المحمول عن طريق الخطأ من الرمز القصير 83332. يرجى الاتصال 08081263000 لاسترداد الرسوم. ستكون هذه المكالمة مجانية من خط أرضي BT,No,No,yes
spam,ست فرص لربح كاش! من 100 إلى 20000 رطل txt> CSH11 وإرسالها إلى 87575. التكلفة 150p / يوم ، 6 أيام ، 16+ تساندكس تطبق رد HL 4 معلومات,No,No,yes
ham,احتفظ بباياسام الخاص بي هناك إذا أحضر rinu,No,No,No
ham,برابها .. أنا آسف,No,No,No
ham,بيل ، كما في: هل هناك رسائل لي. أتوقع واحدة من اللون البرتقالي ليست فاتورة ولكن قد لا تزال تحمل اللون البرتقالي عليها.,No,No,No
ham,مشاهدة فيلم ajith آه؟,No,No,No
ham,حسنًا .. ثانكس ..,No,No,No
ham,عزيزي حصلت على الحافلة مباشرة إلى كاليكوت,No,No,No
ham,هل انت في المدينة؟ هذا هو V. هام,No,No,No
ham,لا هدايا !! هل تحاول أن تجعلني أرمي بنفسي من على منحدر أو شيء من هذا القبيل؟,No,No,No
smishing,تهنئة! تم اختيار رقم هاتفك المحمول كفائز بـ E2000.000.00 على EURO-MEGA DRAW برقم السحب EU-0906767 البريد الإلكتروني robertdep34@gmail.com� للمطالبات,No,yes,No
ham,اوه رائع. سوف تزعجه أكثر حتى نتمكن من التحدث.,No,No,No
ham,لا تلوم يومًا في حياتك أبدًا. الأيام الجيدة تمنحك السعادة. الأيام السيئة تعطيك تجربة.,No,No,No
ham,ولكن إذا كانت تشرب ، فأنا بخير.,No,No,No
spam,88800 و 89034 هي خدمات هاتفية متميزة اتصل على 08718711108,No,No,yes
ham,شكرا جزيلا...,No,No,No
ham,أحبك !!! أنت تعرف؟ هل تشعر به؟ هل تجعل بطنك دافئة؟ أتمنى أن تفعل يا حبيبتي ... سألتقي بك في أحلامك يا أحمد ... * قبلة عشق *,No,No,No
spam,25p 4 أغنية الأطفال المحتاجين لألفي مون على الغوغاء. أخبر m8s الخاص بك. Txt Tone charity إلى 8007 لـ Nokias أو Poly charity for polys: zed 08701417012 الربح 2 الخيرية.,No,No,yes
ham,نعم,No,No,No
ham,معظمهم من النوع الرياضي..لايك فوتبل ، كركت ..,No,No,No
ham,هل حصلت للتو على بعض أموال الغاز ، هل هناك فرصة تريد أنت والعصابة الذهاب في مغامرة طبيعية كبيرة؟,No,No,No
ham,كيف تذهبون يا رفاق لمشاهدة الأفلام بجانبك.,No,No,No
ham,حسنًا ، رائع !!,No,No,No
ham,رائع ، أتذكر آخر مرة حصلنا فيها على شخص منتشي لأول مرة باستخدام الديزل: V.,No,No,No
ham,أوه :) كالمعتاد فيلم فيجاي أم مختلف؟,No,No,No
ham,لا تستطيع ناه مساعدتك هناك ، لم يكن لدي هاتف iPhone من قبل,No,No,No
ham,ما زلت غير مقتنع بأن هذا ليس اختبارًا مفصلاً لقوة إرادتي,No,No,No
ham,لكني أتبع نظامًا غذائيًا. وأكلت 1 الكثير من شرائح البيتزا أمس. آه ، أنا دائمًا أتبع نظامًا غذائيًا.,No,No,No
ham,نسيت أنك كنت تعمل اليوم! هل تريد الدردشة ، ولكن الأمور على ما يرام ، لذا أرسل لي رسالة نصية عندما تكون متفرغًا / بالملل وما إلى ذلك ، وسأقوم بالرنين. آمل أن يكون كل شيء على ما يرام ، مقال الأنف وكل xx,No,No,No
ham,لا استطيع الانتظار لرؤيتك! كيف كانت الصور مفيدة؟ :),No,No,No
ham,موجي أحبك أكثر من الكلمات. أتمنى لك يومًا غنيًا,No,No,No
ham,هل حصلت على قصة هؤلاء الأشخاص .. حسنًا؟,No,No,No
ham,ش تصل بستان بالفعل؟ U wan 2 اذهب لشراء التذاكر أولا؟,No,No,No
ham,رقم في طريق المنزل. لذلك لولا فترة الجفاف الطويلة لكان الموسم قد انتهى,No,No,No
ham,حسنا ابقني على اطلاع,No,No,No
ham,ثم لماذا لا أحد يتحدث معي,No,No,No
ham,سيدي ، أنا في انتظار مكالمتك .. لدي لقاء عاجل لاحقًا ..,No,No,No
ham,مرحبا عزيزي اتصل بي على وجه الاستعجال. لا أعرف ما هي مشكلتك. لا تريد العمل أو إذا كان لديك أي مشكلة أخرى على الأقل أخبرني. ينتظر ردك.,No,No,No
ham,سوف تتوقف على نفسها. ومع ذلك ، أقترح أن تبقى مع شخص يمكنه إعطاء أمهات مقابل كل كرسي.,No,No,No
ham,اممممه العديد من العيد السعيد ليوم د عزيزي القلب الحلو .. عيد ميلاد سعيد عزيزي.,No,No,No
ham,شكرا على تمنياتي الجميلة. انت صخرة,No,No,No
ham,أنا في سوليهل | هل تريد شيئا؟,No,No,No
spam,Tone Club: انتهت صلاحية الاشتراكات الخاصة بك الآن ردان إعادة فرعيان MONOC 4 monos أو POLYC 4 polys 1 أسبوعيًا @ 150p في الأسبوع Txt STOP 2 stop هذا البث المجاني للرسالة 0871212025016,No,No,yes
ham,أين ص ه الاجتماع tmr؟,No,No,No
ham,طلبت من سين أن يأتي إلى تشيناي ويبحث عن عمل.,No,No,No
ham,هل تريد أن ترسل لي عناقًا افتراضيًا؟ ... أحتاج واحدًا,No,No,No
ham,انتهى الليل ليوم آخر ، جاء الصباح بطريقة خاصة. قد تبتسم مثل أشعة الشمس ... Gud mrng,No,No,No
ham,مرحبا الخوخ! مذاق الكيك الخاص بي!,No,No,No
ham,أنا استطيع. لكنه سيخبر طويلاً ، لأنني لم أكمل فيلمي بعد ...,No,No,No
ham,قضاء سنوات جديدة مع أخي وعائلته. دعونا نخطط للقاء الأسبوع المقبل. هل أنت مستعد لتكون مدلل؟ :),No,No,No
ham,Wif عائلتي حزمة جولة الحجز.,No,No,No
ham,انتهى بالفعل ... يار استمروا في القول إنني طري ... لقد شعرت بالحرج الشديد ...,No,No,No
ham,مرحبًا السيد وأنا ذاهبون إلى منظر البحر ولدينا اثنين من الشواذ أعني الألعاب! أعطني جرسًا عندما تنتهي,No,No,No
ham,إيرم ... شارع وودلاند في مكان ما. هل تحصل على مجلة الرعية رقم هاتفه سيكون هناك.,No,No,No
ham,حسنًا ، سأكون عمتًا!,No,No,No
ham,مجرد التدقيق في عليك. حقا لا تفوت رؤية ارميا. أتمنى لك شهرًا رائعًا,No,No,No
smishing,هل تريد الجنس الصريح في 30 ثانية؟ خاتم 02073162414 الآن! تكلف 20p / min,No,No,yes
smishing,يرجى الاتصال بممثل خدمة العملاء لدينا على 7679046492 بين الساعة 10 صباحًا و 9 مساءً نظرًا لأن لديك W0N جائزة نقدية مضمونة بقيمة 700000 روبية. فريق FL1PKART,No,No,yes
ham,ما هو القوس الريشي؟ هل هذا شيء لدى الرجال لا أعرف عنه؟,No,No,No
ham,لماذا استيقظت بمفردي & GT ؛ :(,No,No,No
ham,إذا كنت لا تسعل فلا شيء,No,No,No
ham,أنت تعرف ، wot يرتدي الناس. تي شيرت ، صداري ، قبعة ، حزام ، كل ما نعرفه. نحن ص في كريبس,No,No,No
ham,HIYA COMIN 2 BRISTOL 1 ST WEEK في أبريل. لقد خرجت + رودي في ليلة رأس السنة الجديدة لكنني كنت أشخر. لقد كنت في حالة سكر! U BAK في الكلية بعد؟ عملي يرسل الحبر 2 حمام.,No,No,No
ham,ك .. ك :) أين أنت؟ كيف أديت؟,No,No,No
ham,Nice.nice. كيف تعمل؟,No,No,No
ham,32 هل أعتقد؟ يجب أن يذكر في المنهج,No,No,No
ham,اضحك بصوت عالى انا اعرف! مرحبًا ، قام شخص ما بعمل شخصي رائع للبراغيث في المنتديات. أنا أحبه!,No,No,No
smishing,ماذا تريد لعيد الميلاد؟ ماذا عن 100 رسالة نصية مجانية وهاتف فيديو جديد مع تأجير بنصف السعر؟ اتصل مجانًا الآن على 0800 0721072 لمعرفة المزيد!,No,No,yes
ham,ثم ماذا عن خطة أخرى؟,No,No,No
ham,3 سنوات ولكن لم يتم التحديد.,No,No,No
ham,قلت إنني قادم يوم الأربعاء.,No,No,No
ham,شكرا لك مقابلتك يوم الاثنين,No,No,No
spam,ضاعف دقائقك و txts على Orange أو 1/2 Linerental - Motorola و SonyEricsson مع B / Tooth FREE - اتصل مجانًا من Nokia MobileUpd8 على 08000839402 or2optout / HV9D,No,No,yes
spam,قلل حتى 6 كجم في 30 يومًا مع * حزام الساونا الأصلي سليم * MRP 1499 Com Direct Price 750 احجز اليوم واحصل على حصيرة العلاج بالضغط مجانًا! لحجز الرسائل القصيرة: SLIM إلى 57333,No,No,yes
ham,Nt بعد chikku .. بسيطة habba..hw abt u؟,No,No,No
ham,يبدو أنه تقاعد ويلب,No,No,No
ham,يمكنني أن أسأل كارلوس إذا كان بإمكاننا الحصول على المزيد إذا كان بإمكان أي شخص آخر المشاركة,No,No,No
ham,تأكد من التحقق من بريدك الإلكتروني على ياهو. أرسلنا الصور أمس,No,No,No
smishing,لديك معجب سري. REVEAL الذي يعتقد أن U R مميز جدًا. اتصل على 09065174042. لإلغاء الاشتراك في خدمة Cust Care 07821230901,No,No,yes
ham,عيد ميلاد سعيد ... قد تجد أميرك ساحرًا قريبًا ولا تعمل بجد ...,No,No,No
ham,أي قناة:-):-):):-).,No,No,No
ham,Ta-Daaaaa! أنا في المنزل حبيبي ، هل ما زلت مستيقظًا؟,No,No,No
ham,ضحك بصوت عاطفي من شأنه أن يكون مردودًا رائعًا.,No,No,No
ham,نعم ، لما لا ، هل العصابة جاهزة تمامًا,No,No,No
ham,مبروك ore mo owo re wa. استمتع بها وأتمنى لك الكثير من اللحظات السعيدة ذهاباً وإياباً أينما ذهبت,No,No,No
spam,"يمكنك إيقاف نغمات النادي الأخرى عن طريق الرد ""STOP MIX"" انظر my-tone.com/enjoy. أتش تي أم أل للمصطلحات. نغمات النادي تكلف 4.50 جنيه إسترليني في الأسبوع. MFL ، صندوق بريد 1146 MK45 2WT (2/3)",No,No,No
ham,هل ستعود في أي وقت قريب؟,No,No,No
ham,رائعة. رحلة آمنة. لا داعي للذعر استسلم كل شيء.,No,No,No
