LABEL,TEXT,URL,EMAIL,PHONE
spam,"أصبح رصيدك الآن 600 جنيه إسترليني. السؤال التالي: أكمل المعلم ، Big ، A. Bob ، B. Barry أو C. Ben؟. أرسل رسالة نصية إلى ""أ"" أو ""ب"" أو ""ج"" إلى 83738. حظًا سعيدًا!",No,No,yes
ham,U الدراسة في sch أو الذهاب إلى المنزل؟ على أي حال سأذهب ب 2 sch لاحقًا.,No,No,No
ham,أنا لا أجدها في جيناتك أو شيء من هذا القبيل,No,No,No
ham,طيب كلا أيامنا. إذن ما الذي ستحضرينه على العشاء الليلة؟ هل أنا مدعو؟,No,No,No
ham,آه ، لا أريد النهوض من السرير. كان حارا جدا.,No,No,No
ham,يبدو أنك وجدت شيئًا تفعله بخلاف الدخان ، عمل رائع!,No,No,No
ham,أنا انتهيت. اقطع هنا.,No,No,No
ham,مرحبًا ، سأكون متأخرًا جدًا ... هل تريد الذهاب إلى الدرس أولاً؟ سأنضم إليكم. أنا فقط أصل إلى tp mrt,No,No,No
ham,* عدد قليل من الأشياء للقيام بها. قد يكون في * حانة لاحقًا.,No,No,No
smishing,حظر ATM: عزيزي العميل ، نظرًا لترقية نظامنا ، فقد تم مؤخرًا BL0CKED بطاقة الصراف الآلي الخاصة بك. لإعادة التفعيل ، اتصل بخدمة العملاء للحصول على مساعدة 7908807538 الآن.,No,No,yes
ham,أنت في المدينة وحدها؟,No,No,No
ham,آسف ، لا يمكنني مساعدتك في هذا.,No,No,No
ham,مجانًا في أي يوم ولكني أنهي الساعة 6 يوم الاثنين الخميس ...,No,No,No
smishing,يرجى الاتصال بممثل خدمة العملاء لدينا على 8927307655 بين الساعة 10 صباحًا و 9 مساءً نظرًا لأن لديك W0N جائزة نقدية مضمونة تبلغ 400000 روبية. فريق FL1PKART,No,No,yes
ham,تحدث فقط عندما تشعر أن كلماتك أفضل من الصمت ... Gud mrng :-),No,No,No
ham,أوه ... لقد طلبت المتعة. هاها ... اعتني بنفسك. ü,No,No,No
ham,نيشانث .. tel me who r u؟,No,No,No
ham,لا تزال ترسم الحائط الخاص بك؟,No,No,No
smishing,عزيزي العميل ، لقد تم حجز محفظة pyatm الخاصة بك واحتفظ بالمبلغ الخاص بك ، يرجى إكمال الاتصال بخدمة العملاء kyc 8536074310,No,No,yes
ham,أكل يابي تم أوسو خلف محاضرتك وات ...,No,No,No
ham,نعم ، لقد بدأت في إرسال طلبات للقيام بذلك ولكن الألم عاد لذلك عدت إلى السرير. عملات مزدوجة في المصنع أيضًا. لدي نقود في كل ما عندي من نيتروس.,No,No,No
ham,مساء الخير بريق النجوم! كيف حال فتى؟ هل يتوق لي بعد؟ * رشفات كابتشينو * أفتقدك حبيبي * قبلة إغاظة *,No,No,No
smishing,أنت فائز وقد تم اختيارك خصيصًا لتلقي 1000 جنيه إسترليني نقدًا أو جائزة قدرها 2000 جنيه إسترليني. تحدث إلى عامل تشغيل مباشر للمطالبة بالاتصال على 087123002209 صباحًا - 7 مساءً. التكلفة 10 ص,No,No,yes
ham,مرحبًا دارلين ، انتهيت عند 3 ، هل U 1 2 تلتقطني أو تقابلني؟ ظهر نص على هذا العدد LUV KATE XXX,No,No,No
ham,لول هل نسيت ذلك إيه؟ نعم ، سأحضره حبيبي,No,No,No
ham,رون يقول فري ليه. ن قال إن دينغ تاي فنغ غير قادر على إبداء تحفظات. لكنه قال انتظر لور.,No,No,No
ham,طهارة الصداقة بين الاثنين لا تتعلق بالابتسام بعد قراءة الرسالة المعاد توجيهها .. بل تتعلق بالابتسام بمجرد رؤية الاسم. يوم صداقة سعيد ..,No,No,No
ham,هو هناك. أنت تتصل به وتلتقي به,No,No,No
ham,نعم. أي شيء لور ، إذا كنت تريد ذلك فلا بأس ...,No,No,No
ham,أهه. عمل. أتذكر ذلك بشكل غامض! ما هو شعورك مثل؟ لول,No,No,No
ham,لا ، ستصاب بالصداع وأنت تحاول اكتشافه. يمكنك الوثوق بي للقيام بالحسابات. أعدك. س :-),No,No,No
smishing,ميلا ، 23 سنة ، شقراء ، جديدة في المملكة المتحدة. أبحث عن الجنس مع شباب المملكة المتحدة. إذا كنت تحب المرح معي. أرسل MTALK إلى الرقم 69866.18 اتصل بالرقم 08718728876,No,No,yes
ham,إنه متأخر. هذا هو الجزء المحزن فقط ولكننا نبقى على اتصال بفضل سكايب,No,No,No
ham,مرحبًا ، لقد حجزت درس البيلاتس واليوغا بالفعل ... هاها,No,No,No
ham,أنا عدت مرة أخرى. كوس طويلة قليلاً للحادث على a30. اضطررت إلى التحويل عبر واد بريج ، لقد حظيت بعطلة نهاية أسبوع رائعة شكرًا. تحدث قريبا. الكثير من الحب,No,No,No
ham,هل اكتشفت ما هو الوقت الذي تكون فيه الحافلة في Coz ، فأنا بحاجة إلى فرز بعض الأشياء.,No,No,No
ham,Goodnight da thangam أنا حقا أفتقدك عزيزي.,No,No,No
ham,أتمنى أن تفهم ما أقوله .. لول.,No,No,No
ham,لا حاجة لار. جوس اختبار بطاقة الهاتف الإلكتروني. شبكة dunno لا gd i thk. أنا أنتظر 4 أختي 2 من الاستحمام حتى أتمكن من الاستحمام. دون إزعاج يا لياو يو تنظيف غرفتك.,No,No,No
ham,أعلم أنك تفكر في الملاريا. لكن استرخي ، فالأطفال لا يستطيعون التعامل مع الملاريا. كانت ستصبح أسوأ والتهاب المعدة والأمعاء. إذا أخذت ما يكفي لتعويض خسارتها ، ستقل درجة حرارتها. وإذا أعطيتها أدوية الملاريا الآن فسوف تتقيأ. إنه مرض يحد من نفسه مما يعني أنه سيتوقف تمامًا في غضون أيام قليلة,No,No,No
ham,أمي العزيزة اتصلت بي الآن :-),No,No,No
ham,يبدو أنه يمكن أن يكون هناك الكثير من الوقت الذي يقضيه في ذلك الصبي جهاز العفة ... * ابتسامات * ... أو خذ ضربك مثل كلب جيد. ذاهب إلى الاسترخاء في حمام طويل لطيف الآن؟,No,No,No
ham,ما تخطط للقيام به في يوم عيد الحب يوم 14 فبراير,No,No,No
ham,"مرحبا ... استيقظ ..! ""صباح"" ""حلوة"" ""ترحب"" بـ ""أنت"" ""استمتع"" بـ ""هذا اليوم"" ""مليئة بالفرح"" .. ""GUD MRNG"".",No,No,No
smishing,ميلا ، 23 سنة ، شقراء ، جديدة في المملكة المتحدة. أبحث عن الجنس مع شباب المملكة المتحدة. إذا كنت تحب المرح معي. أرسل MTALK إلى 69866.18. 30pp / txt 1st 5free. 1.50 جنيه إسترليني. مساعدة,No,No,yes
ham,لقد أرسلنا JD for Customer Service cum Accounts Executive إلى معرف البريد الخاص بك ، لمزيد من التفاصيل اتصل بنا,No,No,No
ham,مرحبًا ، لقد حجزت كيلوبايت يوم السبت بالفعل ... ما هي الدروس الأخرى التي سنذهب إليها؟ حافظ على ليلة جلوسك خالية ، نحتاج إلى مقابلة وتأكيد إقامتنا,No,No,No
ham,لا توجد رسالة .. لا يوجد رد .. ماذا حدث؟,No,No,No
ham,أخبرتها أن لديّ تطبيق دكتور في الأسبوع المقبل. هي تعتقد أنني سأموت. أخبرتها أنه مجرد شيك. لا شيء يدعو للقلق. لكنها لم تستمع.,No,No,No
ham,لدي موعدان في محرري المستندات الأسبوع المقبل: / لقد سئمت منهم دفع الأشياء لي. يا إلهي لماذا لم أستطع الحصول على جسم طبيعي؟,No,No,No
ham,ما لم يكن الوضع حيث تكون GURL أكثر ملاءمة,No,No,No
ham,أين كنت تختبئ أيها الغريب؟,No,No,No
ham,"تحت البحر ، هناك صخرة. في الصخرة يوجد مغلف. في الظرف هناك ورقة. على الورق ، هناك ثلاث كلمات ... ""خمن !!",No,No,No
ham,سوبر دا :) بديل جيد للوراري,No,No,No
ham,من متع الحياة الاستيقاظ كل يوم بأفكار يهتم بها شخص ما في مكان ما بما يكفي لإرسال تحية صباحية دافئة .. -,No,No,No
ham,أبيج ، جني الأرباح. لكنها البداية. هل تستخدمه للحصول على رعاة للحدث القادم؟,No,No,No
ham,تم التصويت على الأردن خارج الليلة الماضية!,No,No,No
ham,عليك أن تدون الثابتة والمتنقلة ملاحظة بكل ما تتعرض له. اكتشف أيضًا من مدرستها ما إذا كان أي شخص آخر يتقيأ. هل يوجد كلب أو قطة في المنزل؟ اسمحوا لي أن أعرف لاحقا.,No,No,No
ham,شكرا جميلتي. أتمنى لك يوماً عظيماً.,No,No,No
ham,أريد أن أمسك بغنائمك الجميلة :),No,No,No
ham,يا صاح كيف تحب الرياح برتقالية.,No,No,No
ham,ثانكس 4 2 يوم! أنت صديق جيد أعتقد UR RITE SARY! ASUSUAL! 1 U سعيد لي! الحب يو فرنسا xxxxxx,No,No,No
ham,هاها أعتقد أنني فعلت ذلك أيضًا,No,No,No
ham,نام؟ أعتقد أن هذه المرة (& lt ؛ # & GT ؛ مساء) ليست خطيرة,No,No,No
ham,نعم احصل على اللامحدودة,No,No,No
ham,في هذه الأثناء في جناح القرف: قرر كزافييه إعطائنا & lt؛ # & gt؛ ثوانٍ من التحذير من أن سامانثا قادمة وهي تعزف على جيتار جاي لإثارة إعجابها أو بعض الهراء. كما أنني لا أعتقد أن دوج يدرك أنني لم أعد أعيش هنا,No,No,No
ham,أنا ذاهب إلى 2 بستان الآن بسرعة تصلني قريبًا. يو تصل؟,No,No,No
ham,إذا لم تكن هنا في التالي & lt؛ # & gt؛ ساعات imma الوجه القرف بلدي,No,No,No
smishing,أتقنه! 4 * Costa Del Sol Holiday أو 5000 جنيه إسترليني في انتظار التحصيل. اتصل على 09050090033 الآن للمطالبة. SAE ، المساهمين الأساسيين ، صندوق البريد 334 ، Stockport ، SK38xh ، التكلفة 1.50 جنيه إسترليني / مساءً ، بحد أقصى 10 دقائق,No,No,yes
ham,أنا على متن حافلة دا ذاهبًا إلى المنزل ...,No,No,No
ham,هاها نعم أرى ذلك الآن ، ستكون هناك في غضون ثوان,No,No,No
ham,اتصل بك لاحقا ، ليس لدي شبكة. إذا ملحة ، أرسل لي رسالة قصيرة.,No,No,No
ham,يحتاج ساري فقط إلى تيم في اللوز ويؤذيه كثيرًا لذا فهو يطلب مني!,No,No,No
ham,إيه تتذكر كيف تهجئ اسمه ... نعم أتذكر. كان شقي حتى كنت مبتلا.,No,No,No
ham,حسنًا ، سأبقى لمدة ساعة لأن عيني مؤلمة حقًا!,No,No,No
ham,كيف البطل يغادر للتو غلاسكو!,No,No,No
ham,يو تشاد أي حصة جمباز تريد الالتحاق بها؟ يقول الموقع ان حصة المسيحيين ممتلئة ..,No,No,No
ham,هاها رائع ، كن هناك خلال دقيقة,No,No,No
ham,ك. سأرسلها مرة أخرى .. آسف على الخطأ ..,No,No,No
ham,كانت سنواتي الجديدة على ما يرام. ذهبت إلى حفلة مع صديقي. من هذا SI ثم مرحبًا,No,No,No
ham,أنا في المنزل وجاهز ...,No,No,No
ham,كنت على وشك القيام بذلك عندما قمت بإرسال رسالة نصية. انتهيت منذ زمن طويل واستحممت ووجدت أي شيء!,No,No,No
ham,لا يمكنني انتظار كورنوال. آمل أن هذه الليلة ليست سيئة للغاية أيضًا لكنها صخرة ليلة القرف. على أي حال أنا ذاهب لكيب الآن ليلة سعيدة. اكلمك قريبا.,No,No,No
spam,500 هاتف محمول جديد من عام 2004 ، يجب أن تذهب! TXT: NOKIA إلى رقم: 89545 وجمع ما يخصك اليوم من 1 جنيه إسترليني فقط www.4-tc.biz 2optout 087187262701.50gbp / mtmsg18 TXTAUCTION,yes,No,yes
ham,لا تعرف ما هو أمر صداقة رائيل ، أنا أمنحك مثالًا: Jsut ese tihs msg .. Evrey splleing of tihs msg is wrnog .. Bt sitll yuo can raed it wihtuot ayn mitsake .. GOODNIGHT & amp؛ تمتع بنوم لطيف .. أحلام حلوة ..,No,No,No
ham,ممم تطلب منه أن يأتي ، يكفي :-),No,No,No
ham,مرحبًا ، الأمور لم تسر على ما يرام تمامًا - إنها تتأرجح ببطء إلى المنزل متبوعة بـ aa ويتدلى العادم,No,No,No
ham,أهلاً! هذا روجر من CL. كيف حالك؟,No,No,No
ham,لا ، لكنني سأذهب إلى المنزل الآن ، ثم اذهب إلى ضخ البنزين ... مثل الذهاب إلى المطر قريبًا ...,No,No,No
spam,نحن متخصصون في وضع الأشخاص في عمليات البيع والشراء الخاصة بالعميل الرئيسي. توظيف 4 جمع / cce / tse 4 أعلى 10 Bpos مع sal + inc.DAYSHIFT av.Tanvi / 9953921288,No,No,yes
spam,للحصول على أكثر فترات التسوق تألقًا من 45 فردًا ؛ اتصل على 0121 2025050 أو قم بزيارة www.shortbreaks.org.uk,yes,No,yes
ham,نعم!! ليست جيدة,No,No,No
smishing,بصفتي عميلًا مهمًا ، يسعدني أن أخبرك أنه بعد السحب الأخير لرقم هاتفك المحمول ، ستحصل على جائزة مكافأة قدرها 1000000 روبية ، اتصل على 7044518857,No,No,yes
ham,K.k :) فيلم apo k.good.,No,No,No
ham,إذن ü هل سيتم تقديم طقوس مشروع da tmr؟,No,No,No
ham,عيد ميلاد سعيد ... قد تجد أميرك ساحرًا قريبًا وتبقى سعيدًا !!,No,No,No
ham,مجنون ar انه متزوج. Ü مثل الرجال الذين ينظرون إلى gd وليس أنا. أصدقائي مثل يقولون إنه مفضل لـ korean leona ولكني أعتقد أنه كذلك. بعد بعض التفكير ربما سأذهب على الأرجح.,No,No,No
ham,مرحبًا ، ما زلت على الإنترنت؟ لقد انتهيت من التنسيق ...,No,No,No
spam,عادت Fantasy Football إلى التلفزيون. انتقل إلى Sky Gamestar على Sky Active والعب 250 ألف جنيه إسترليني Dream Team. سجل الآن! SKY OPT OUT إلى 88088,No,No,yes
ham,يبدو وكأنه شيء يقوله شخص ما يختبرني,No,No,No
ham,Aight يو ، داتس دوج مستقيم,No,No,No
ham,لا أصدق أنني قلت لك أشياء كثيرة هذا الصباح عندما كان كل ما أردت قوله هو صباح الخير ، أحبك! أتمنى لك صباح جميل. نراكم في المكتبة لاحقا.,No,No,No
spam,احصل على هاتف محمول جديد تمامًا من خلال كونك وكيلًا لـ The Mob! بالإضافة إلى المزيد من الأشياء الجيدة! لمزيد من المعلومات ، فقط أرسل MAT إلى 87021.,No,No,yes
ham,أنا أكره عندما تفعل هذا. لقد حولت ما يجب أن يكون يومًا ممتعًا إلى يوم مزعج من المشاجرات.,No,No,No
smishing,تهانينا ، تمت مراجعة سيرتك الذاتية وتم إدراجك في القائمة المختصرة. يرجى استكمال طلب الوظيفة عن طريق الاتصال بـ 120 * 22446 #,No,No,yes
spam,اجعل حياتك المهنية دليلًا على الركود مع برنامج الماجستير التنفيذي لمدة عام واحد في أمن المعلومات ، واحصل على 1،88،000 * وظائف. أرسل رسالة نصية قصيرة SMS أو اتصل بـ MS @ 9717470558,No,No,yes
ham,ثم أي خاص هناك؟,No,No,No
ham,كانت تلعب لعبة 9 أبواب وسباق جي تي على الهاتف لول,No,No,No
ham,يقول إنه يستقيل 5 مرات في اليوم على الأقل ، لذا لن ألاحظ ذلك كثيرًا. ناه ، لم تمانع. هل ستراه مرة أخرى؟ هل تريد أن تأتي إلى تونتون الليلة؟ يمكنك أن تخبرني كل شيء عن!,No,No,No
ham,أنا شاب ، متصفح إجباري,No,No,No
ham,سأكون هناك مع in & lt؛ # & GT؛ الدقائق. حصلت على أي مساحة,No,No,No
ham,تذكر كل أولئك الذين آذيت خلال أيام الدجال الشيطاني بداخلي ، وتحتاج إلى دفع ثمن ، فليكن ذلك ، وقد يبقيني القدر ، وكما قلت ، أصلي أن أحصل على ذهني للتغلب على نفس الشيء.,No,No,No
spam,مراجعة السعر قريبا !! Agni Property توصي Spaze Privy The Address في Sec-93 ، Gurgaon @ 28 Lac وما بعده. 2/3/4 BHK Apts متاح للحجز اتصل على 9212255555 الآن!,No,No,yes
spam,أرسل شعار 2 حبيبك - اسمان مرتبطان بقلب. أرسل LOVE NAME1 NAME2 MOBNO مثل LOVE ADAM EVE 07123456789 إلى 87077 Yahoo! صندوق بريد 36504W45WQ TxtNO 4 بدون إعلانات 150 ص.,No,No,yes
ham,الأشياء الجيدة ، ستفعل.,No,No,No
ham,سأصل قبل العاشرة صباحًا,No,No,No
smishing,بصفتي عميلًا مهمًا ، يسعدني أن أخبرك أنه بعد المراجعة الأخيرة لرقم Mob الخاص بك ، يتم منحك جائزة مكافأة قدرها 1500 جنيه إسترليني ، اتصل على 09066364589,No,No,yes
ham,استعد للقصف كل ليلة ...,No,No,No
spam,تقوم مراكز نوفا الطبية بإجراء عيادة آلام الكتف في الخامس من مارس.,No,No,yes
ham,آسف دا. لقد جن جنون الكثير من الأعمال المعلقة ماذا أفعل.,No,No,No
ham,الوقت n الابتسامة r أهم شيئين في حياتنا. أحيانًا يجعلنا الوقت ننسى الابتسام ، وأحيانًا تجعلنا ابتسامة شخص ما ننسى وقت الظهيرة,No,No,No
ham,لا .. قبل ساعات قليلة ذهبت لقص الشعر.,No,No,No
ham,إذا كنت تضحك بصوت عالٍ حقًا .. إذا تحدثت بشكل عفوي .. إذا كنت لا تهتم بما يشعر به الآخرون .. ربما تكون مع عزيزك & amp؛ أعز الأصدقاء .. الخير عزيزي .. :),No,No,No
ham,وظهرت علامة & lt ؛ # & GT. لم يكن الإيبوبروفين مفيدًا.,No,No,No
ham,أتمنى أن تعرف أنني ما زلت غاضبًا منك.,No,No,No
ham,هل أنت متاح الآن؟ أنا مثل الحق في جميع أنحاء hillsborough & amp؛ العلامة & lt ؛ # & GT. العاشر,No,No,No
ham,كيفز قصة هؤلاء الأشخاص .. هل سمعت ذلك؟,No,No,No
smishing,العاجلة! لقد فزت بعضوية مجانية لمدة أسبوع في جائزة Jackpot الخاصة بنا التي تبلغ قيمتها 100000 جنيه إسترليني! أرسل الكلمة: CLAIM to No: 81010 T&C www.dbuk.net,yes,No,No
ham,علمني التطبيقات da. عندما تأتي إلى الكلية.,No,No,No
ham,وأنا لا أخطط للبقاء في الليل لكنني لن أعود كثيرًا حتى وقت متأخر,No,No,No
ham,أهلاً! لقد تحدثت للتو إلى MANEESHA V. إذا كنت راضيًا عن التجربة. الرد بنعم آخر لا.,No,No,No
ham,"مؤلم للغاية وخطوط ذات مغزى على الإطلاق: ""لقد تنازلت عن كل شيء من أجل حبي ، لكن في النهاية ، عرضني حبي على كل شيء :-("" .. Gud mornin :-)",No,No,No
ham,اتصل بي عندما تحصل على فرصة ارجوك & lt؛ 3,No,No,No
ham,ربما تريد أن تلتقط المزيد؟,No,No,No
ham,يجب ألا يكون هناك ثلج. يجب ألا يكون هناك ثلج. يجمع هذا النوع من الطقس الأشخاص معًا حتى تنمو الصداقات.,No,No,No
ham,ط ط ط هذا أفضل الآن حصلت على تحميص أسفل لي! من الأفضل أن أكون قد تناولت القليل من المشروبات أسفل مني 2! هندي جيد؟,No,No,No
ham,عندما تريد رؤيته بعد ذلك,No,No,No
ham,كالعادة .. أنا بخير وسعيد & amp؛ بخير .. :) Howz u؟,No,No,No
ham,staff.science.nus.edu.sg/~phyhcmk/teaching/pc1323,No,No,No
ham,أريدك أن تكون بين ذراعي القويتين ...,No,No,No
smishing,هل ترغب في توصيل هاتف Nokia 3510i الملون جديدًا غدًا؟ مع 200 دقيقة مجانية لأي محمول + 100 texReply مجانًا أو اتصل على 08000930705,No,No,yes
ham,سوف أصل إلى المكتب حول & lt؛ DECIMAL & GT؛ . & أمبير ؛ هاتفي المحمول لديه مشكلة. لا يمكنك الحصول على صوتي. لذا اتصل بك asa سأحرر,No,No,No
ham,حسنًا ، العمل الذكي !!,No,No,No
ham,Juz الآن لم يستيقظ حتى يطمس قليلا ... هل؟ ذهب أبي ياو ... لا أستطيع أن نائب الرئيس الآن أوسو ...,No,No,No
smishing,خاص! كشف حساب 2003 الخاص بك يظهر 800 S.I.M. غير المستردة نقاط. اتصل 08718738001 كود التعريف: 49557 تنتهي في 26/11/04,No,No,yes
ham,مرحبًا دارلين ، لقد انتهيت من الكلية الآن ، لذا أرسل لي عندما تنتهي إذا كنت تستطيع أن تحب كيت xxx,No,No,No
spam,اربح عرضًا سنويًا من الأقراص المضغوطة 4 متجرًا من اختيارك بقيمة 500 جنيه إسترليني وادخل 100 جنيه إسترليني في السحب الأسبوعي txt MUSIC إلى 87066 Ts & Cs www.Ldew.com.subs16 + 1win150ppmx3,yes,No,yes
ham,أنا أحبك 2 أنا آسف لكني أحبك,No,No,No
ham,R نحن نذهب مع & lt ؛ # & GT ؛ أوتوبيس؟,No,No,No
ham,وصف لي دكتور مورفين لأن أدوية الألم الأخرى ليست كافية. في انتظار أمي لإحضارها. يجب أن يبدأ هذا med بسرعة لذا سأحاول أن أكون في وقت لاحق,No,No,No
ham,نعم سأكون هناك. سعيد لانك فعلتها,No,No,No
ham,لا عزيزي. . تانو ذاهب للحديث في تلفزيون سوريا,No,No,No
ham,كم حصلت على التنظيف,No,No,No
ham,كاليس جاهز للمضرب في الشوط الثاني,No,No,No
ham,اين انت حبيب أنا بحاجة إليك ...,No,No,No
ham,اشترت Shuhui هدية رون إنها ساعة حامل ...,No,No,No
ham,اين انت متى ستصل الى هنا,No,No,No
ham,هل لديك يوم جميل اليوم. أحبك كثيرا.,No,No,No
ham,ها ... إذن يجب أن نسير إلى كل مكان ... لا يمكن ركوب الترام. قال ابن عمي إنه يمكن أن يمشي إلى السوق من فندقنا,No,No,No
smishing,تشترك U في أفضل خدمة محتوى للجوال في المملكة المتحدة مقابل 3 جنيهات إسترلينية لكل عشرة أيام حتى ترسل STOP إلى 83435. خط المساعدة 08706091795.,No,No,yes
ham,براكش يعرف هناك.,No,No,No
ham,كيف حال حبيبي؟ ما الذي يفعله ويمنعه من القدوم إلى ملكته ، هممم؟ ألا يتألم أن يتحدث معي؟ افتقدني بشدة؟,No,No,No
ham,من هم هؤلاء الناس؟ هل كنت في جولة؟ اعتقدت أنك كنت تفعل ذلك الشيء الذي أرسلته لي الأريكة؟ السكر الفضولي الخاص بك,No,No,No
ham,افعل جيدا :) كل شيء سوف لوقت قصير. شيء من الأوقات الجيدة المقبلة:,No,No,No
ham,أنا في المنزل ... اتصل بي,No,No,No
ham,أنا لا أفهم رسالتك.,No,No,No
ham,طيب لور ... أو هل تريد أن أذهب أنظر 4 يو؟,No,No,No
ham,كيف حالك الاطفال. أتمنى أن تكون بخير. كان لي ليلة القرف من النوم. لقد نمت في الساعة الخامسة ، لقد شعرت بالخوف وأنا أخاف من العمل الليلة. ماذا ستفعل الليلة. X,No,No,No
ham,خرج للتو ، متجهًا لتسليم أشيائي الآن,No,No,No
spam,لقد فزت بالمال رقم 946 الذي أفعله بعد ذلك,No,No,No
ham,عادل بما فيه الكفاية ، أي شيء يحدث؟,No,No,No
ham,مرحبًا. لا توجد أخبار عن العمل ، إنهم يجعلونني أنتظر أسبوعًا خامسًا! نعم ، أنا مستعد لبعض woozles وأعراس ... في إكستر لا يزال ، لكن كن في المنزل حوالي 3.,No,No,No
